{
 "schemaId": "spacer.contracts.analysis-document",
 "schemaVersion": "1.0.0",
 "documentKind": "analysis-document",
 "documentId": "90574c29-dac3-52c9-996d-705405ebbb4a",
 "projectId": "c83b911b-d2a3-4f25-a3b5-0c9c9792e1c2",
 "revisionId": 1,
 "status": "DRAFT",
 "contentChecksum": "4685609a13015244d6826c6ca2c9651ed00a635d0599c921b99a760c628f0566",
 "modelChecksum": "4685609a13015244d6826c6ca2c9651ed00a635d0599c921b99a760c628f0566",
 "provenance": {
  "createdAt": "2026-08-14T22:06:44.407Z",
  "createdBy": "cim-integrated3d",
  "producer": "spacer-analysis-module"
 },
 "timestamps": {
  "updatedAt": "2026-08-14T22:06:44.407Z",
  "derivedAt": "2026-08-14T22:06:44.407Z"
 },
 "sourceReferences": {
  "bridgeLayout": null,
  "superstructure": null,
  "substructure": null,
  "loadFingerprint": null,
  "solverSettingsFingerprint": null
 },
 "coordinateContext": {
  "entityId": "e50834d0-1326-57fd-9bb3-7c10ecdedbba",
  "coordinatePolicyId": null,
  "axisConvention": "x-along/y-transverse/z-up",
  "handedness": "right",
  "unitSystem": "metric",
  "positionConvention": "project-global-XYZ",
  "signConvention": {
   "reactionZ": "up-positive",
   "moment": "right-hand-rule",
   "skew": "counterclockwise-positive"
  },
  "globalOrigin": {
   "x": 0,
   "y": 0,
   "z": 0
  }
 },
 "unitContext": {
  "length": "m",
  "force": "kN",
  "moment": "kNm",
  "modulus": "kN/m2",
  "density": "kN/m3",
  "angle": "rad"
 },
 "nodes": [
  {
   "entityId": "013868c7-d265-5a28-b6e5-aea2d88b0dd3",
   "sourceEntityId": "supportPoint:A1:G1",
   "sourceKind": "supportPoint",
   "x": 200,
   "y": 496,
   "z": 103.08,
   "stationM": 100,
   "offsetM": -4
  },
  {
   "entityId": "17323aa9-8164-533f-b311-263e3766a216",
   "sourceEntityId": "supportPoint:A1:G2",
   "sourceKind": "supportPoint",
   "x": 200,
   "y": 504,
   "z": 102.92,
   "stationM": 100,
   "offsetM": 4
  },
  {
   "entityId": "8a2298f6-4bb0-569b-b483-ebfceebf5e8d",
   "sourceEntityId": "supportPoint:P1:G1",
   "sourceKind": "supportPoint",
   "x": 400,
   "y": 496,
   "z": 108.55916666666667,
   "stationM": 300,
   "offsetM": -4
  },
  {
   "entityId": "a84e12c6-472c-5d34-8085-d35f4762ba90",
   "sourceEntityId": "supportPoint:P1:G2",
   "sourceKind": "supportPoint",
   "x": 400,
   "y": 504,
   "z": 108.39916666666667,
   "stationM": 300,
   "offsetM": 4
  },
  {
   "entityId": "682689b8-25dd-5ddc-984b-b976a0045dfb",
   "sourceEntityId": "supportPoint:A2:G1",
   "sourceKind": "supportPoint",
   "x": 503.05676642196096,
   "y": 582.7106705334637,
   "z": 106.58,
   "stationM": 450,
   "offsetM": -4
  },
  {
   "entityId": "32071005-893b-5424-8547-479df7b6765a",
   "sourceEntityId": "supportPoint:A2:G2",
   "sourceKind": "supportPoint",
   "x": 495.13898203108243,
   "y": 581.566690490124,
   "z": 106.42,
   "stationM": 450,
   "offsetM": 4
  },
  {
   "entityId": "8dbeba99-b811-5da8-8593-655b213a32ec",
   "sourceEntityId": "girderPanel:G1:110",
   "sourceKind": "girderPanel",
   "x": 210,
   "y": 496,
   "z": 103.35395833333334,
   "stationM": 110,
   "offsetM": -4
  },
  {
   "entityId": "e87a2769-adbe-5662-a93e-96c36bafb20a",
   "sourceEntityId": "girderPanel:G1:120",
   "sourceKind": "girderPanel",
   "x": 220,
   "y": 496,
   "z": 103.62791666666666,
   "stationM": 120,
   "offsetM": -4
  },
  {
   "entityId": "cf991bbf-10d0-5ebe-8322-7b9287c68eaf",
   "sourceEntityId": "girderPanel:G1:130",
   "sourceKind": "girderPanel",
   "x": 230,
   "y": 496,
   "z": 103.901875,
   "stationM": 130,
   "offsetM": -4
  },
  {
   "entityId": "8f762b65-1d6f-502c-8b41-6a378a4b1dee",
   "sourceEntityId": "girderPanel:G1:140",
   "sourceKind": "girderPanel",
   "x": 240,
   "y": 496,
   "z": 104.17583333333333,
   "stationM": 140,
   "offsetM": -4
  },
  {
   "entityId": "e7ed48e3-70a7-57f7-ad89-4eb808e0e0dd",
   "sourceEntityId": "girderPanel:G1:150",
   "sourceKind": "girderPanel",
   "x": 250,
   "y": 496,
   "z": 104.44979166666667,
   "stationM": 150,
   "offsetM": -4
  },
  {
   "entityId": "cad57473-a0d9-52b6-bf8f-aa68a63e58b6",
   "sourceEntityId": "girderPanel:G1:160",
   "sourceKind": "girderPanel",
   "x": 260,
   "y": 496,
   "z": 104.72375,
   "stationM": 160,
   "offsetM": -4
  },
  {
   "entityId": "8af66610-9fae-5046-b524-2772a2771437",
   "sourceEntityId": "girderPanel:G1:170",
   "sourceKind": "girderPanel",
   "x": 270,
   "y": 496,
   "z": 104.99770833333334,
   "stationM": 170,
   "offsetM": -4
  },
  {
   "entityId": "2db7fa26-e89c-5f49-b4e9-5924996c63af",
   "sourceEntityId": "girderPanel:G1:180",
   "sourceKind": "girderPanel",
   "x": 280,
   "y": 496,
   "z": 105.27166666666666,
   "stationM": 180,
   "offsetM": -4
  },
  {
   "entityId": "5b29c8b4-a7f3-5c3d-be53-c44068e744b9",
   "sourceEntityId": "girderPanel:G1:190",
   "sourceKind": "girderPanel",
   "x": 290,
   "y": 496,
   "z": 105.545625,
   "stationM": 190,
   "offsetM": -4
  },
  {
   "entityId": "8a656662-041a-5a72-a17c-e4f61cdf3553",
   "sourceEntityId": "girderPanel:G1:200",
   "sourceKind": "girderPanel",
   "x": 300,
   "y": 496,
   "z": 105.81958333333333,
   "stationM": 200,
   "offsetM": -4
  },
  {
   "entityId": "45d88e99-5a5a-55da-8b3a-570e0ec6ffd7",
   "sourceEntityId": "girderPanel:G1:210",
   "sourceKind": "girderPanel",
   "x": 310,
   "y": 496,
   "z": 106.09354166666667,
   "stationM": 210,
   "offsetM": -4
  },
  {
   "entityId": "6a214641-330a-5766-a6ed-6621cca4f30a",
   "sourceEntityId": "girderPanel:G1:220",
   "sourceKind": "girderPanel",
   "x": 320,
   "y": 496,
   "z": 106.3675,
   "stationM": 220,
   "offsetM": -4
  },
  {
   "entityId": "560d2d7b-1e2f-5d88-a89b-18fdec4c0a2d",
   "sourceEntityId": "girderPanel:G1:230",
   "sourceKind": "girderPanel",
   "x": 330,
   "y": 496,
   "z": 106.64145833333333,
   "stationM": 230,
   "offsetM": -4
  },
  {
   "entityId": "703ad71f-18b1-57a4-bff2-892715ebb7c6",
   "sourceEntityId": "girderPanel:G1:240",
   "sourceKind": "girderPanel",
   "x": 340,
   "y": 496,
   "z": 106.91541666666667,
   "stationM": 240,
   "offsetM": -4
  },
  {
   "entityId": "f5807284-4ba5-570c-89fb-0fc75d98a48d",
   "sourceEntityId": "girderPanel:G1:250",
   "sourceKind": "girderPanel",
   "x": 350,
   "y": 496,
   "z": 107.189375,
   "stationM": 250,
   "offsetM": -4
  },
  {
   "entityId": "7296b5d8-ac6f-527d-bcd1-f89444b67651",
   "sourceEntityId": "girderPanel:G1:260",
   "sourceKind": "girderPanel",
   "x": 360,
   "y": 496,
   "z": 107.46333333333334,
   "stationM": 260,
   "offsetM": -4
  },
  {
   "entityId": "1708f554-32f2-536f-8c12-71b85ce479ae",
   "sourceEntityId": "girderPanel:G1:270",
   "sourceKind": "girderPanel",
   "x": 370,
   "y": 496,
   "z": 107.73729166666666,
   "stationM": 270,
   "offsetM": -4
  },
  {
   "entityId": "d988724d-6dd2-5cb6-ac50-7a33f05ff592",
   "sourceEntityId": "girderPanel:G1:280",
   "sourceKind": "girderPanel",
   "x": 380,
   "y": 496,
   "z": 108.01125,
   "stationM": 280,
   "offsetM": -4
  },
  {
   "entityId": "fda21377-56e9-5581-abfc-ed5cc339aa16",
   "sourceEntityId": "girderPanel:G1:290",
   "sourceKind": "girderPanel",
   "x": 390,
   "y": 496,
   "z": 108.28520833333333,
   "stationM": 290,
   "offsetM": -4
  },
  {
   "entityId": "4029b659-6a04-570a-8cee-ec8fb2d199e0",
   "sourceEntityId": "girderPanel:G1:310",
   "sourceKind": "girderPanel",
   "x": 406.8704510947974,
   "y": 501.7807113688976,
   "z": 108.42722222222223,
   "stationM": 310,
   "offsetM": -4
  },
  {
   "entityId": "00e18dcb-ed9c-56a8-b6bb-eff77336f47e",
   "sourceEntityId": "girderPanel:G1:320",
   "sourceKind": "girderPanel",
   "x": 413.7409021895948,
   "y": 507.56142273779517,
   "z": 108.29527777777778,
   "stationM": 320,
   "offsetM": -4
  },
  {
   "entityId": "ae43ffe4-87cd-5fc7-b421-370166bc4e1a",
   "sourceEntityId": "girderPanel:G1:330",
   "sourceKind": "girderPanel",
   "x": 420.6113532843922,
   "y": 513.3421341066927,
   "z": 108.16333333333334,
   "stationM": 330,
   "offsetM": -4
  },
  {
   "entityId": "ef6f907c-90bd-54a8-b993-07799d74a756",
   "sourceEntityId": "girderPanel:G1:340",
   "sourceKind": "girderPanel",
   "x": 427.4818043791896,
   "y": 519.1228454755903,
   "z": 108.03138888888888,
   "stationM": 340,
   "offsetM": -4
  },
  {
   "entityId": "6fd7e2f5-28c7-5a64-85bf-3e87c4c95f91",
   "sourceEntityId": "girderPanel:G1:350",
   "sourceKind": "girderPanel",
   "x": 434.352255473987,
   "y": 524.9035568444879,
   "z": 107.89944444444444,
   "stationM": 350,
   "offsetM": -4
  },
  {
   "entityId": "75cd443d-2960-54f8-9ba3-5159b0bf7fb3",
   "sourceEntityId": "girderPanel:G1:360",
   "sourceKind": "girderPanel",
   "x": 441.22270656878436,
   "y": 530.6842682133855,
   "z": 107.7675,
   "stationM": 360,
   "offsetM": -4
  },
  {
   "entityId": "e9429f1b-d885-52d9-bbf4-4de712d50d4a",
   "sourceEntityId": "girderPanel:G1:370",
   "sourceKind": "girderPanel",
   "x": 448.0931576635818,
   "y": 536.464979582283,
   "z": 107.63555555555556,
   "stationM": 370,
   "offsetM": -4
  },
  {
   "entityId": "07597b9d-2959-56f4-a4c5-7d7d0c324946",
   "sourceEntityId": "girderPanel:G1:380",
   "sourceKind": "girderPanel",
   "x": 454.96360875837917,
   "y": 542.2456909511807,
   "z": 107.50361111111111,
   "stationM": 380,
   "offsetM": -4
  },
  {
   "entityId": "7d0cb490-57f0-5851-8e81-ad010caa75d3",
   "sourceEntityId": "girderPanel:G1:390",
   "sourceKind": "girderPanel",
   "x": 461.83405985317654,
   "y": 548.0264023200782,
   "z": 107.37166666666667,
   "stationM": 390,
   "offsetM": -4
  },
  {
   "entityId": "eeada9c8-5dd6-5f29-a4be-546a0c0a34c9",
   "sourceEntityId": "girderPanel:G1:400",
   "sourceKind": "girderPanel",
   "x": 468.704510947974,
   "y": 553.8071136889758,
   "z": 107.23972222222223,
   "stationM": 400,
   "offsetM": -4
  },
  {
   "entityId": "4f2a7845-f71f-55c1-80a7-7c238d224c21",
   "sourceEntityId": "girderPanel:G1:410",
   "sourceKind": "girderPanel",
   "x": 475.57496204277135,
   "y": 559.5878250578734,
   "z": 107.10777777777778,
   "stationM": 410,
   "offsetM": -4
  },
  {